<?xml version="1.0" encoding="UTF-8" standalone="no"?>
<libreria xmlns:xsi="http://www.w3.org/2001/XMLSchema-instance"
xsi:noNamespaceSchemaLocation="ej2.xsd">
	<codigo>1263</codigo>
	<direccion>C/ Juan de Juni 31</direccion>
	<telefono>98355555</telefono>
	<propietario>
		<nombre>Juanito</nombre>
	</propietario>
	<libro codigo="c111">
		<titulo> Cien años de soledad </titulo>
		<autores> Gabriel García Márquez </autores>
		<formato>tapa blanda</formato>
		<publicacion>1967</publicacion>
		<precio oferta="si">23.5</precio>
	</libro>
	<libro codigo="c222">
		<titulo> Cocina de autor </titulo>
		<autores> 
			<autor>Pedro Pérez Pintor</autor>
			<autor>Ana Alvarez Alba</autor>
		</autores>
		<formato>bolsillo</formato>
		<publicacion>2020</publicacion>
		<precio>20</precio>
	</libro>
</libreria>
